{
  "schema_version": "1.1",
  "approval_request_id": "appr_network_change_001",
  "project_id": "proj_customer_support_ai",
  "environment": "preprod",
  "request_type": "network_policy_change",
  "trigger": "network_policy_changes",
  "requested_by": "svc_pearl_worker",
  "required_roles": [
    "security_review",
    "platform_owner"
  ],
  "artifact_refs": [
    "rs_preprod_egress_fix_001"
  ],
  "status": "pending",
  "created_at": "2026-02-21T10:30:00-06:00",
  "expires_at": "2026-02-24T10:30:00-06:00",
  "trace_id": "trc_appr_001"
}
